title,genres,language,seasons,episodes
Mr. Sunshine,"Korean Drama, Action, Drama, Romance, War",Korean,1,24
Pod prikritie,"Action, Crime, Drama",Bulgarian,5,60
Foyle's War,"Period Drama, Police Procedural, Whodunnit, Crime, Drama, Mystery, War",English,8,28
Letterkenny,"Quirky Comedy, Sitcom, Comedy",English,12,81
Gintama,"Anime, Parody, Satire, Sh≈çnen, Slapstick, Action, Animation, Comedy, Sci-Fi",Japanese,9,225
From the Earth to the Moon,"Docudrama, Action, Drama, History, Thriller",English,1,12
Wentworth Prison,"Prison Drama, Crime, Drama, Thriller",English,9,100
Umbre,"Gangster, Crime, Drama, Thriller","English, Romanian",3,21
All Creatures Great & Small,"Period Drama, Comedy, Drama",English,5,35
Extraordinary Attorney Woo,"Korean Drama, Legal Drama, Drama",Korean,1,16
Avrupa Yakasi,"Sitcom, Comedy",Turkish,6,190
Doctor Who,"Sci-Fi Epic, Space Sci-Fi, Time Travel, Adventure, Drama, Sci-Fi",English,15,175
Hannibal,"Psychological Horror, Psychological Thriller, Serial Killer, Crime, Drama, Horror, Mystery, Thriller",English,3,39
North & South,"Coming-of-Age, Costume Drama, Period Drama, Drama, Romance",English,1,4
The Expanse,"Dystopian Sci-Fi, Space Sci-Fi, Drama, Mystery, Sci-Fi",English,6,62
Fullmetal Alchemist,"Anime, Sh≈çnen, Steampunk, Action, Adventure, Animation, Comedy, Drama, Fantasy, Sci-Fi",Japanese,1,51
Futurama,"Adult Animation, Hand-Drawn Animation, Satire, Sitcom, Space Sci-Fi, Adventure, Animation, Comedy, Sci-Fi",English,14,180
Rurôni Kenshin: Meiji kenkaku romantan - Tsuioku-hen,"Anime, Samurai, Sh≈çnen, Action, Adventure, Animation, Drama, History, Romance",Japanese,1,4
Shameless,"Dark Comedy, Comedy, Drama",English,11,134
My Brilliant Friend,"Coming-of-Age, Drama",Italian,4,34
Silicon Valley,"Quirky Comedy, Sitcom, Comedy",English,6,53
Skam,"Coming-of-Age, Teen Drama, Drama, Romance",Norwegian,4,43
Brass Eye,"Parody, Satire, Comedy",English,2,7
Alchemy of Souls,"Dark Fantasy, Fantasy Epic, Feel-Good Romance, Korean Drama, Sword & Sorcery, Action, Drama, Fantasy, Romance, Thriller",Korean,2,30
Schitt's Creek,"Satire, Sitcom, Comedy",English,6,80
Formula 1: Drive to Survive,"Docuseries, Motorsport, Sports Documentary, Documentary, Sport",English,7,61
Spartacus: Gods of the Arena,"Action Epic, Period Drama, Sword & Sandal, Action, Adventure, Biography, Drama, History, Romance",English,1,6
Trailer Park Boys,"Mockumentary, Raunchy Comedy, Sitcom, Stoner Comedy, Comedy, Crime",English,12,106
Neon Genesis Evangelion,"Action Epic, Adult Animation, Alien Invasion, Anime, Coming-of-Age, Cyberpunk, Dystopian Sci-Fi, Epic, Hand-Drawn Animation, Kaiju",Japanese,1,26
The Office UK,"Mockumentary, Satire, Sitcom, Comedy, Drama",English,3,202
Through the Wormhole,"Science & Technology Documentary, Documentary",English,7,62
Derry Girls,"Sitcom, Teen Comedy, Comedy",English,3,19
Twin Peaks,"Psychological Horror, Suspense Mystery, Crime, Drama, Horror, Mystery, Thriller",English,3,48
Louie,"Dark Comedy, Comedy, Drama",English,5,61
Sons of Anarchy,"Gangster, Crime, Drama, Thriller",English,7,92
Whose Line Is It Anyway?,"Sketch Comedy, Talent Competition, Comedy, Game Show",English,8,220
The Eric Andre Show,"Parody, Sketch Comedy, Comedy, Talk Show",English,6,68
Regular Show,"Adult Animation, Buddy Comedy, Hand-Drawn Animation, Sitcom, Action, Adventure, Animation, Comedy, Drama, Family",English,8,244
Spartacus,"Sword & Sandal, Action, Adventure, Biography, Drama, Romance",English,3,33
Mob Psycho 100,"Anime, Coming-of-Age, Sh≈çnen, Superhero, Teen Fantasy, Action, Animation, Comedy, Drama, Fantasy",Japanese,3,37
Long Way Round,"Docuseries, Adventure, Documentary",English,1,10
Spaced,"Quirky Comedy, Sitcom, Comedy",English,2,14
Jujutsu Kaisen,"Adult Animation, Anime, Dark Fantasy, Sh≈çnen, Supernatural Fantasy, Urban Adventure, Action, Adventure, Animation, Fantasy",Japanese,3,48
Happy Valley,"Cop Drama, Police Procedural, Crime, Drama, Thriller",English,3,18
Impractical Jokers,"Hidden Camera, Comedy, Reality TV",English,12,309
Samurai Jack,"Dark Fantasy, Hand-Drawn Animation, One-Person Army Action, Samurai, Time Travel, Action, Adventure, Animation, Drama, Fantasy",English,5,62
Detectorists,"Buddy Comedy, Sitcom, Comedy",English,3,20
I'm Alan Partridge,"Satire, Sitcom, Comedy",English,2,12
Mr. Robot,"Cyber Thriller, Psychological Drama, Psychological Thriller, Crime, Drama, Thriller",English,4,45
Ezel,"Crime, Drama, Thriller",Turkish,2,71
Yellowstone,"Contemporary Western, Epic, Western Epic, Drama, Western",English,5,53
Senke nad Balkanom,"Crime, Drama, Thriller",Serbian,2,20
Making a Murderer,"Crime Documentary, Docuseries, True Crime, Crime, Documentary",English,2,20
The Bear,"Psychological Drama, Workplace Drama, Comedy, Drama",English,4,29
Coupling,"Farce, Raunchy Comedy, Sitcom, Comedy, Romance",English,4,28
The IT Crowd,"Quirky Comedy, Sitcom, Comedy",English,5,26
Rocket Boys,"Historical Epic, Drama, History",Hindi,2,16
The Queen's Gambit,"Coming-of-Age, Epic, Period Drama, Psychological Drama, Drama",English,1,7
Samurai Champloo,"Adult Animation, Anime, Martial Arts, Samurai, Action, Adventure, Animation, Comedy, Drama, Thriller",Japanese,1,26
Flight of the Conchords,"Quirky Comedy, Comedy, Music, Musical",English,2,22
"Yes, Prime Minister","Satire, Sitcom, Comedy",English,2,16
Endeavour,"Cop Drama, Whodunnit, Crime, Drama, Mystery",English,9,36
The Venture Bros.,"Adult Animation, Hand-Drawn Animation, Parody, Superhero, Action, Adventure, Animation, Comedy, Fantasy, Sci-Fi",English,7,86
Battlestar Galactica,"Artificial Intelligence, Space Sci-Fi, Action, Adventure, Drama, Sci-Fi",English,4,76
Justice League,"Hand-Drawn Animation, Superhero, Action, Adventure, Animation, Family, Fantasy, Mystery, Sci-Fi",English,2,52
The Haunting of Hill House,"Psychological Horror, Supernatural Horror, Drama, Horror, Mystery, Thriller",English,1,10
The Family Man,"Action, Comedy, Drama, Thriller",Hindi,3,20
What We Do in the Shadows,"Mockumentary, Sitcom, Vampire Horror, Comedy, Fantasy, Horror",English,6,61
The Bugs Bunny Show,"Hand-Drawn Animation, Animation, Comedy",English,3,78
Justified,"Contemporary Western, Cop Drama, Police Procedural, Action, Crime, Drama, Mystery, Thriller, Western",English,6,78
QI,"Comedy, Game Show",English,22,358
Young Justice,"Superhero, Action, Adventure, Animation, Crime, Fantasy, Romance, Sci-Fi",English,4,122
Homicide: Life on the Street,"Cop Drama, Police Procedural, Crime, Drama, Mystery, Thriller",English,7,99
Demon Slayer: Kimetsu no Yaiba,"Anime, Dark Fantasy, Sh≈çnen, Supernatural Fantasy, Action, Adventure, Animation, Fantasy, Thriller",Japanese,5,69
Yeh Meri Family,"Comedy, Drama, Family, Musical, Romance",Hindi,4,22
Boardwalk Empire,"Epic, Gangster, Period Drama, Political Drama, Crime, Drama",English,5,56
El Chavo del Ocho,"Slapstick, Comedy, Family",Spanish,7,357
The Bureau,"Political Drama, Political Thriller, Spy, Drama, Thriller",French,5,50
Dopesick,"Docudrama, Medical Drama, Tragedy, Drama",English,1,8
The Newsroom,"Political Drama, Workplace Drama, Drama",English,3,25
Archer,"Adult Animation, Parody, Sitcom, Action, Animation, Comedy",English,14,144
Critical Role,"Quest, Adventure, Fantasy",English,3,153
Mystery Science Theatre 3000,"Farce, Quirky Comedy, Space Sci-Fi, Comedy, Sci-Fi",English,11,199
Anne,"Period Drama, Teen Drama, Drama, Family",English,3,27
Greatest Events of WWII in Colour,"History Documentary, Military Documentary, Documentary, History, War",English,1,10
Blackadder the Third,"Satire, Comedy",English,1,6
Pose,"Epic, Drama",English,3,26
Yes Minister,"Satire, Sitcom, Comedy",English,3,22
Gomorrah,"Epic, Gangster, Crime, Drama, Thriller",Spanish,5,58
Scavengers Reign,"Adult Animation, Sci-Fi Epic, Space Sci-Fi, Adventure, Animation, Drama, Sci-Fi",English,1,12
Fighting Spirit,"Anime, Boxing, Sh≈çnen, Action, Animation, Comedy, Sport",English,1,51
The Offer,"Docudrama, Showbiz Drama, Biography, Crime, Drama",English,1,10
Crash Landing on You,"Feel-Good Romance, Korean Drama, Adventure, Comedy, Drama, Romance",Korean,1,19
The Return of Sherlock Holmes,"Police Procedural, Whodunnit, Crime, Drama, Mystery",English,2,13
The Jinx: The Life and Deaths of Robert Durst,"Crime Documentary, Docuseries, True Crime, Biography, Crime, Documentary, Mystery",English,2,12
Haikyuu!!,"Anime, Sh≈çnen, Teen Comedy, Teen Drama, Animation, Comedy, Drama, Sport",Japanese,4,89
Mr. Bean,"Sitcom, Slapstick, Comedy, Family",English,1,15
Poirot,"Cozy Mystery, Police Procedural, Whodunnit, Crime, Drama, Mystery, Thriller",English,13,70
Mindhunter,"Cop Drama, Docudrama, Police Procedural, Psychological Drama, Psychological Thriller, Serial Killer, Crime, Drama, Mystery, Thriller",English,2,19
Lonesome Dove,"Epic, Western Epic, Adventure, Drama, Western",English,1,4
Blackadder II,"Satire, Sitcom, Comedy",English,1,6
Shōgun,"Action Epic, Period Drama, War Epic, Adventure, Drama, History, War",Japanese,1,12
Primal,"Adult Animation, Dinosaur Adventure, Action, Adventure, Animation, Drama, Fantasy, Horror",English,2,21
Daredevil,"Gangster, Legal Drama, Superhero, Action, Crime, Drama, Fantasy, Sci-Fi, Thriller",English,3,39
The Bridge,"Cop Drama, Police Procedural, Serial Killer, Suspense Mystery, Crime, Mystery, Thriller",Danish,4,38
Mr Inbetween,"Comedy, Crime, Drama",English,3,26
It's a Sin,"Coming-of-Age, Drama",English,1,5
The Penguin,"Gangster, Tragedy, Crime, Drama",English,1,8
Ramayan,"Epic, Fantasy Epic, Period Drama, Adventure, Drama, Family, Fantasy, Musical, War",Sanskrit,1,51
The Crown,"Costume Drama, Epic, Historical Epic, Period Drama, Political Drama, Biography, Drama, History",English,6,60
Adventure Time,"Adult Animation, Buddy Comedy, Hand-Drawn Animation, Sword & Sorcery, Teen Adventure, Teen Comedy, Teen Fantasy, Action, Adventure, Animation",English,10,288
Dexter,"Psychological Drama, Psychological Thriller, Serial Killer, Suspense Mystery, Crime, Drama, Mystery, Thriller",English,8,96
Deadwood,"Classical Western, Epic, Historical Epic, Period Drama, Crime, Drama, History, Western",English,3,36
Atlanta,"Satire, Comedy, Drama, Music",English,4,41
The X Files,"Alien Invasion, Conspiracy Thriller, Police Procedural, Suspense Mystery, Adventure, Crime, Drama, Mystery, Sci-Fi, Thriller",English,11,217
House of Cards,"Epic, Political Drama, Drama",English,6,73
Parks and Recreation,"Mockumentary, Satire, Sitcom, Comedy",English,7,124
Aspirants,"Workplace Drama, Drama",Hindi,2,10
The Mandalorian,"Action Epic, Adventure Epic, Fantasy Epic, One-Person Army Action, Sci-Fi Epic, Space Sci-Fi, Action, Adventure, Fantasy, Sci-Fi",English,3,25
Code Geass: Lelouch of the Rebellion,"Anime, Mecha, Political Drama, Supernatural Fantasy, Action, Animation, Drama, Fantasy, Sci-Fi, Thriller",Japanese,2,54
Father Ted,"Sitcom, Comedy",English,3,25
Sarabhai V/S Sarabhai,"Sitcom, Comedy",Hindi,2,61
This Is Us,"Epic, Romantic Epic, Comedy, Drama, Romance",English,6,106
Behzat Ç: An Ankara Detective Story,"Cop Drama, Police Procedural, Crime, Drama, Mystery, Thriller",Turkish,4,105
How to with John Wilson,"Docuseries, Comedy, Documentary",English,3,18
The Thick of It,"Satire, Sitcom, Comedy",English,4,24
1883,"Period Drama, Western Epic, Drama, Western",English,1,10
Top Gear,"Motorsport, Travel, Adventure, Sport, Talk Show",English,33,296
Stranger Things,"Dark Fantasy, Fantasy Epic, Monster Horror, Sci-Fi Epic, Supernatural Fantasy, Supernatural Horror, Teen Horror, Drama, Fantasy, Horror",English,5,42
The Marvelous Mrs. Maisel,"Period Drama, Showbiz Drama, Comedy, Drama",English,5,43
Line of Duty,"Cop Drama, Police Procedural, Suspense Mystery, Crime, Drama, Mystery, Thriller",English,6,36
Mahabharat,"Epic, Period Drama, War Epic, Action, Adventure, Drama, Fantasy, History, Musical, War",Hindi,1,51
Friday Night Lights,"Coming-of-Age, Football, Teen Drama, Drama, Sport",English,5,76
The Boys,"Dark Comedy, Raunchy Comedy, Satire, Superhero, Action, Comedy, Crime, Drama, Sci-Fi",English,5,40
Invincible,"Adult Animation, Superhero, Action, Adventure, Animation, Drama, Fantasy, Sci-Fi, Thriller",English,4,25
The Adventures of Sherlock Holmes,"Police Procedural, Whodunnit, Crime, Drama, Mystery",English,2,13
Justice League Unlimited,"Hand-Drawn Animation, Superhero, Action, Adventure, Animation, Family, Fantasy, Sci-Fi",English,3,39
Monster,"Adult Animation, Anime, Psychological Thriller, Seinen, Animation, Crime, Drama, Mystery, Thriller",Japanese,1,52
Naruto: Shippuden,"Anime, Martial Arts, Sh≈çnen, Action, Adventure, Animation, Comedy, Drama, Fantasy",Japanese,21,52
One Punch Man,"Anime, Superhero, Action, Animation, Comedy, Family, Fantasy, Sci-Fi",Japanese,2,25
Arrested Development,"Quirky Comedy, Sitcom, Comedy",English,5,84
House M.D.,"Medical Drama, Drama, Mystery",English,8,176
Star Trek: The Next Generation,"Space Sci-Fi, Action, Adventure, Drama, Sci-Fi",English,7,176
Peep Show,"Buddy Comedy, Quirky Comedy, Sitcom, Comedy",English,9,54
The Simpsons,"Adult Animation, Farce, Hand-Drawn Animation, Satire, Sitcom, Animation, Comedy",English,36,781
Mad Men,"Epic, Period Drama, Workplace Drama, Drama",English,7,92
Blue Eye Samurai,"Adult Animation, Period Drama, Samurai, Action, Adventure, Animation, Drama, History, Thriller",English,1,9
The Grand Tour,"Motorsport, Comedy, Sport, Talk Show",English,6,46
The Shield,"Cop Drama, Police Procedural, Crime, Drama, Thriller",English,7,89
Downton Abbey,"Costume Drama, Period Drama, Drama, Romance",English,6,52
The Last of Us,"Dystopian Sci-Fi, Quest, Survival, Zombie Horror, Action, Adventure, Drama, Horror, Sci-Fi, Thriller",English,2,16
Fleabag,"Dark Comedy, Raunchy Comedy, Comedy, Drama",English,2,12
Severance,"Conspiracy Thriller, Dystopian Sci-Fi, Psychological Drama, Psychological Thriller, Workplace Drama, Drama, Mystery, Sci-Fi, Thriller",English,2,19
Dark,"Epic, Psychological Drama, Psychological Thriller, Suspense Mystery, Time Travel, Crime, Drama, Mystery, Sci-Fi, Thriller",German,3,26
Berserk,"Action Epic, Adult Animation, Adventure Epic, Anime, Dark Fantasy, Epic, Fantasy Epic, Hand-Drawn Animation, Seinen, Splatter Horror",Japanese,1,25
My Mister,"Korean Drama, Drama, Family",Korean,1,16
Oz,"Prison Drama, Crime, Drama, Thriller",English,6,56
Rome,"Period Drama, Sword & Sandal, Action, Drama, Romance, War",English,2,22
Steins;Gate,"Anime, Time Travel, Animation, Comedy, Drama, Mystery, Romance, Sci-Fi, Thriller",Japanese,1,26
Six Feet Under,"Dark Comedy, Psychological Drama, Comedy, Drama",English,5,63
X-Men '97,"Adult Animation, Superhero, Action, Adventure, Animation, Fantasy, Sci-Fi",English,1,12
Peaky Blinders,"Gangster, Period Drama, Crime, Drama",English,6,36
Reply 1988,"Korean Drama, Comedy, Drama, Family, Romance",Korean,1,20
Ted Lasso,"Soccer, Workplace Drama, Comedy, Drama, Sport",English,3,35
Over the Garden Wall,"Dark Fantasy, Folk Horror, Supernatural Fantasy, Supernatural Horror, Adventure, Animation, Comedy, Drama, Family, Fantasy",English,1,10
Black Mirror,"Cyber Thriller, Dystopian Sci-Fi, Psychological Drama, Psychological Thriller, Suspense Mystery, Tragedy, Crime, Drama, Mystery, Sci-Fi",English,7,33
South Park,"Adult Animation, Dark Comedy, Farce, Parody, Raunchy Comedy, Satire, Sitcom, Animation, Comedy",English,26,327
Kota Factory,"Comedy, Drama",Hindi,3,15
"I, Claudius","Epic, Period Drama, Political Drama, Sword & Sandal, Biography, Drama, History",English,1,13
Gullak,"Comedy, Drama, Family",Hindi,4,20
Vinland Saga,"Adult Animation, Anime, Historical Epic, One-Person Army Action, Period Drama, Seinen, Tragedy, Action, Adventure, Animation",Japanese,1,48
Bleach: Thousand-Year Blood War,"Anime, Sh≈çnen, Supernatural Fantasy, Urban Adventure, Action, Adventure, Animation, Fantasy",Japanese,3,41
Narcos,"Docudrama, Drug Crime, Epic, Police Procedural, True Crime, Biography, Crime, Drama, Thriller",English,3,30
Chappelle's Show,"Satire, Sketch Comedy, Comedy, Music",English,3,33
Freaks and Geeks,"Coming-of-Age, Teen Comedy, Teen Drama, Comedy, Drama",English,1,18
Pride and Prejudice,"Costume Drama, Period Drama, Romantic Epic, Drama, Romance",English,1,6
Blackadder Goes Forth,"Satire, Sitcom, Comedy, War",English,1,6
Panchayat,"Comedy, Drama",Hindi,4,32
Leyla ile Mecnun,"Romantic Epic, Adventure, Comedy, Drama, Fantasy, Mystery, Romance",Turkish,7,144
Fawlty Towers,"Farce, Sitcom, Slapstick, Comedy",English,2,12
The Chosen,"Historical Epic, Drama, History",English,5,42
BoJack Horseman,"Adult Animation, Dark Comedy, Psychological Drama, Satire, Showbiz Drama, Sitcom, Animation, Comedy, Drama",English,6,77
Das Boot,"War Epic, Drama, War",German,1,3
Curb Your Enthusiasm,"Dark Comedy, Sitcom, Comedy",English,12,120
Monty Python's Flying Circus,"Farce, Satire, Sketch Comedy, Slapstick, Comedy",English,4,45
One Piece,"Action Epic, Adult Animation, Adventure Epic, Anime, Fantasy Epic, Globetrotting Adventure, Martial Arts, Quest, Sea Adventure, Sh≈çnen",Japanese,1,66
The West Wing,"Political Drama, Drama",English,7,155
TVF Pitchers,"Comedy, Drama",Hindi,2,10
Succession,"Dark Comedy, Epic, Satire, Tragedy, Workplace Drama, Comedy, Drama, Financial Drama",English,4,39
It's Always Sunny in Philadelphia,"Dark Comedy, Satire, Sitcom, Comedy",English,17,179
Last Week Tonight with John Oliver,"News, Satire, Comedy, Talk Show",English,12,37
Friends,"Feel-Good Romance, Parody, Romantic Comedy, Sitcom, Comedy, Romance",English,10,235
When They See Us,"Docudrama, Legal Drama, Teen Drama, True Crime, Biography, Crime, Drama, History",English,1,4
Africa,"Nature Documentary, Documentary",English,1,7
Frieren: Beyond Journey's End,"Anime, Fantasy Epic, Iyashikei, Sh≈çnen, Sword & Sorcery, Adventure, Animation, Comedy, Drama, Fantasy",Japanese,1,29
Taskmaster,"Comedy, Game Show",English,19,182
Apocalypse: The Second World War,"History Documentary, Military Documentary, Documentary, History, War",French,1,6
Sahsiyet,"Psychological Thriller, Crime, Drama, Mystery, Thriller",Turkish,2,22
Nathan for You,"Docuseries, Quirky Comedy, Comedy, Documentary",English,4,32
Fargo,"Dark Comedy, Crime, Drama, Thriller",English,5,51
True Detective,"Cop Drama, Epic, Hard-boiled Detective, Police Procedural, Psychological Drama, Psychological Thriller, Serial Killer, Suspense Mystery, Whodunnit, Crime",English,4,31
As If,"Buddy Comedy, Comedy",Turkish,5,56
Cowboy Bebop,"Adult Animation, Anime, Cyberpunk, Space Sci-Fi, Action, Adventure, Animation, Comedy, Drama, Sci-Fi",Japanese,1,26
The Beatles: Get Back,"Docuseries, Music Documentary, Biography, Documentary, Music",English,1,3
Dekalog,"Psychological Drama, Drama",Polish,1,10
Seinfeld,"Sitcom, Comedy",English,9,172
Gravity Falls,"Dark Fantasy, High-Concept Comedy, Quirky Comedy, Satire, Supernatural Fantasy, Adventure, Animation, Comedy, Family, Fantasy",English,2,41
Death Note,"Adult Animation, Anime, Cop Drama, Hard-boiled Detective, Legal Drama, Police Procedural, Psychological Drama, Psychological Thriller, Serial Killer, Sh≈çnen",Japanese,1,37
The Civil War,"Docuseries, History Documentary, Military Documentary, Documentary, History, War",English,1,9
Only Fools and Horses,"Sitcom, Comedy",English,9,64
Firefly,"Space Sci-Fi, Adventure, Drama, Sci-Fi",English,1,14
Hunter x Hunter,"Adult Animation, Anime, Quest, Sh≈çnen, Supernatural Fantasy, Action, Adventure, Animation, Comedy, Fantasy",Japanese,1,51
Frozen Planet,"Nature Documentary, Documentary",English,1,10
Human Planet,"Nature Documentary, Travel Documentary, Documentary",English,1,8
Scam 1992: The Harshad Mehta Story,"Docudrama, True Crime, Biography, Crime, Drama, Thriller, Financial Drama",Hindi,1,10
Clarkson's Farm,"Comedy, Documentary, Reality TV",English,4,25
The Blue Planet,"Nature Documentary, Documentary",English,1,8
Better Call Saul,"Drug Crime, Epic, Legal Drama, Psychological Drama, Tragedy, Crime, Drama",English,6,63
Arcane,"Action Epic, Adult Animation, Computer Animation, Steampunk, Supernatural Fantasy, Action, Adventure, Animation, Drama, Fantasy",English,2,18
Batman: The Animated Series,"Hand-Drawn Animation, Superhero, Urban Adventure, Action, Adventure, Animation, Crime, Family, Mystery, Sci-Fi",English,4,76
Sherlock,"Police Procedural, Whodunnit, Crime, Drama, Mystery, Thriller",English,4,15
Attack on Titan,"Action Epic, Adult Animation, Anime, Sh≈çnen, Survival, Tragedy, Action, Adventure, Animation, Drama",Japanese,4,98
The Vietnam War,"Docuseries, History Documentary, Military Documentary, Documentary, History, War",English,1,10
The Twilight Zone,"Dark Fantasy, Dystopian Sci-Fi, Space Sci-Fi, Supernatural Fantasy, Supernatural Horror, Time Travel, Drama, Fantasy, Horror, Mystery",English,5,156
The Last Dance,"Basketball, Docuseries, Sports Documentary, Biography, Documentary, History, Sport",English,1,10
Rick and Morty,"Adult Animation, Farce, Parody, Satire, Sitcom, Time Travel, Adventure, Animation, Comedy, Sci-Fi",English,8,78
Life,"Docuseries, Nature Documentary, Documentary",English,1,11
Fullmetal Alchemist: Brotherhood,"Anime, Sh≈çnen, Steampunk, Action, Adventure, Animation, Comedy, Drama, Fantasy, Sci-Fi",Japanese,1,55
The World at War,"Docuseries, History Documentary, Military Documentary, Documentary, History, War",English,1,26
Bluey,"Animal Adventure, Animation, Family",English,4,193
Game of Thrones,"Action Epic, Dark Fantasy, Epic, Fantasy Epic, Sword & Sorcery, Tragedy, Action, Adventure, Drama, Fantasy",English,8,74
Our Planet,"Docuseries, Nature Documentary, Documentary",English,2,12
The Sopranos,"Epic, Gangster, Crime, Drama",English,6,86
Blue Planet II,"Nature Documentary, Documentary",English,1,7
Avatar: The Last Airbender,"Globetrotting Adventure, Hand-Drawn Animation, Martial Arts, Quest, Supernatural Fantasy, Teen Fantasy, Action, Adventure, Animation, Family",English,2,62
The Wire,"Cop Drama, Drug Crime, Epic, Police Procedural, Crime, Drama, Thriller",English,5,60
Chernobyl,"Disaster, Docudrama, Epic, Historical Epic, Period Drama, Drama, History, Thriller",English,1,5
Band of Brothers,"Historical Epic, Tragedy, War Epic, Action, Drama, History, War",English,1,10
Planet Earth,"Docuseries, Nature Documentary, Documentary, Family",English,1,11
Planet Earth II,"Docuseries, Nature Documentary, Documentary",English,1,6
Breaking Bad,"Drug Crime, Epic, Psychological Drama, Psychological Thriller, Tragedy, Crime, Drama, Thriller",English,5,62